{
  "$schema": "http://json-schema.org/draft-07/schema#",
  "$id": "https://full-video-pipeline/animations/shatter.schema.json",
  "title": "Shatter instance",
  "description": "Per-template schema for shatter. Core TemplateConfig fields (theme/global) are $ref-d from the global animations.schema.json. This template does NOT own content — it shatters arbitrary `children` passed by the caller, so `elements[]` is unconstrained (any id) and typically empty. extras.* are extended here.",
  "type": "object",
  "additionalProperties": false,
  "required": ["extras"],
  "properties": {
    "$schema": {"type": "string"},
    "instanceId": {"type": "string"},
    "theme": {"$ref": "https://full-video-pipeline/schemas/animations.schema.json#/definitions/theme"},
    "global": {"$ref": "https://full-video-pipeline/schemas/animations.schema.json#/definitions/global"},
    "elements": {
      "type": "array",
      "description": "Currently unused by shatter itself — content is passed as `children` to <Shatter>. Kept in the schema for DeepConfig pipeline compatibility.",
      "items": {
        "type": "object",
        "additionalProperties": true,
        "required": ["id"],
        "properties": {
          "id": {"type": "string"},
          "text": {"type": ["string", "null"]},
          "delay": {"type": ["number", "null"], "minimum": 0, "maximum": 60000},
          "duration": {"type": ["number", "null"], "minimum": 1, "maximum": 60000},
          "easing": {"$ref": "https://full-video-pipeline/schemas/animations.schema.json#/definitions/easingName"},
          "position": {"$ref": "https://full-video-pipeline/schemas/animations.schema.json#/definitions/element/properties/position"},
          "size": {
            "type": "object",
            "additionalProperties": false,
            "properties": {
              "fontSize": {"type": ["number", "null"], "minimum": 4, "maximum": 1000},
              "scale": {"type": ["number", "null"], "minimum": 0.05, "maximum": 20}
            }
          },
          "color": {"$ref": "https://full-video-pipeline/schemas/animations.schema.json#/definitions/element/properties/color"},
          "hidden": {"type": "boolean", "default": false},
          "custom": {"type": "object"}
        }
      }
    },
    "extras": {
      "type": "object",
      "additionalProperties": false,
      "properties": {
        "radius": {"type": "number", "minimum": 0.01, "maximum": 2, "default": 0.4, "description": "Radius of the shatter lens, relative to the screen height. The lens sweeps horizontally across the frame during the composition"},
        "softness": {"type": "number", "minimum": 0, "maximum": 1, "default": 0.6, "description": "Edge feather of the lens as a fraction of the radius (0 to 1)"},
        "tileSize": {"type": "number", "minimum": 24, "maximum": 600, "default": 125, "description": "Tile size in CSS pixels"},
        "shards": {"type": "number", "minimum": 0, "maximum": 1, "default": 1, "description": "Shape irregularity. 0 keeps a perfect square grid, 1 breaks the page into uneven glass shards"},
        "corner": {"type": "number", "minimum": 0, "maximum": 300, "default": 0, "description": "Corner rounding of fully lifted tiles in CSS pixels"},
        "lift": {"type": "number", "minimum": 0, "maximum": 600, "default": 30, "description": "How high tiles lift off the page in CSS pixels"},
        "tilt": {"type": "number", "minimum": 0, "maximum": 3, "default": 2, "description": "How steeply tiles tip out of the page plane (0 to 3)"},
        "scatter": {"type": "number", "minimum": 0, "maximum": 300, "default": 5, "description": "How far tiles slide sideways while lifted, in CSS pixels"},
        "perspective": {"type": "number", "minimum": 200, "maximum": 5000, "default": 1500, "description": "Perspective distance in CSS pixels. Lower is more dramatic"},
        "gapColor": {
          "type": "array",
          "minItems": 3,
          "maxItems": 3,
          "items": {"type": "number", "minimum": 0, "maximum": 1},
          "default": [0, 0, 0],
          "description": "Color of the void behind lifted tiles as [r, g, b] in 0-1 range"
        },
        "shadow": {"type": "number", "minimum": 0, "maximum": 2, "default": 0.5, "description": "Opacity of the drop shadows under lifted tiles (0 to 2)"},
        "shading": {"type": "number", "minimum": 0, "maximum": 2, "default": 0.5, "description": "Strength of the per-tile lighting (0 to 2)"},
        "refraction": {"type": "number", "minimum": 0, "maximum": 2, "default": 1.5, "description": "How strongly lifted shards refract the content beneath them, like glass (0 to 2)"},
        "dispersion": {"type": "number", "minimum": 0, "maximum": 1, "default": 0.3, "description": "Chromatic fringing of the refraction (0 to 1). 0 keeps it color-true"},
        "floatSpeed": {"type": "number", "minimum": 0, "maximum": 20, "default": 2, "description": "Speed of the floating tile motion. 0 freezes the tiles"},
        "strength": {"type": "number", "minimum": 0, "maximum": 1, "default": 1, "description": "How fully tiles lift inside the lens (0 to 1)"},
        "baseStrength": {"type": "number", "minimum": 0, "maximum": 1, "default": 0, "description": "Lift amount across the whole screen, outside the lens (0 to 1)"},
        "lensPath": {
          "type": "array",
          "description": "Lens path: waypoints {x, y, at} the lens follows over the composition. x/y are normalized screen positions (y is CSS-style: 0 = top, 1 = bottom; x outside 0-1 moves the lens off-frame for enter/exit). at is composition progress (0-1). The lens moves between waypoints with smoothstep timing. Default: a left-to-right sweep across the composition. A static lens = two identical waypoints. Empty/missing falls back to the default sweep",
          "items": {
            "type": "object",
            "additionalProperties": false,
            "required": ["x", "y", "at"],
            "properties": {
              "x": {"type": "number", "minimum": -0.5, "maximum": 1.5, "description": "Normalized horizontal lens center (0-1 across the frame; outside the frame for enter/exit)"},
              "y": {"type": "number", "minimum": -0.5, "maximum": 1.5, "description": "Normalized vertical lens center, CSS y-down (0 = top, 1 = bottom)"},
              "at": {"type": "number", "minimum": 0, "maximum": 1, "description": "Composition progress (0-1) at which the lens reaches this waypoint"}
            }
          }
        },
        "activePath": {
          "type": "array",
          "description": "Activation envelope: waypoints {at, v} of the lens's uActive over the composition. v = 0 lens off, 1 fully on; at is composition progress (0-1). Smoothstepped between waypoints. Default: on for the whole composition. 'Nothing until a shatter at 60%' = [{at: 0, v: 0}, {at: 0.6, v: 0}, {at: 0.62, v: 1}] (hold v at 0 until the trigger, then step up — the step is eased). 'Then reform at 80%' appends {at: 0.8, v: 0}. For a grow-in over the whole composition instead, {at: 0, v: 0} to {at: 1, v: 1} ramps from start to end",
          "items": {
            "type": "object",
            "additionalProperties": false,
            "required": ["at", "v"],
            "properties": {
              "at": {"type": "number", "minimum": 0, "maximum": 1, "description": "Composition progress (0-1) at which the envelope reaches this value"},
              "v": {"type": "number", "minimum": 0, "maximum": 1, "description": "uActive value at this waypoint (0 = lens off, 1 = fully on)"}
            }
          }
        },
        "scrollTo": {
          "type": "number",
          "minimum": -1,
          "maximum": 1,
          "default": 1,
          "description": "How much of the page's scroll distance the composition covers: 1 scrolls top to bottom, -1 bottom to top, |v| < 1 covers a fraction, 0 pins the page still (the lens still works over a static page)"
        }
      }
    }
  }
}
