{"$schema": "./schema.json", "instanceId": "shatter.defaults", "theme": {}, "global": {"speed": 1, "delayOffset": 0, "easing": "ease-out-cubic"}, "elements": [], "extras": {"radius": 0.4, "softness": 0.6, "tileSize": 125, "shards": 1, "corner": 0, "lift": 30, "tilt": 2, "scatter": 5, "perspective": 1500, "gapColor": [0, 0, 0], "shadow": 0.5, "shading": 0.5, "refraction": 1.5, "dispersion": 0.3, "floatSpeed": 2, "strength": 1, "baseStrength": 0, "lensPath": [{"x": -0.25, "y": 0.5, "at": 0}, {"x": 1.25, "y": 0.5, "at": 1}], "activePath": [{"at": 0, "v": 1}], "scrollTo": 1}}
